{
  "snapshot_version": "1",
  "snapshot_id": "6a8a77fc65bdf47b9bb3a753d7709875671df20e32838344f29cfba46a13f6d6",
  "observed_at": "2026-09-08T12:00:00.000000Z",
  "ctm": {
    "ctm_version": "2",
    "envelope": {
      "branch": "fylgja-fixture",
      "at": "2026-09-08T12:00:00Z",
      "observed_at": "2026-09-08T12:00:00.000000Z",
      "schema_hash": "fixture",
      "scope": "tag:fylgja",
      "mapping": {
        "reader": "infrahub-dcim",
        "model": "opsmill/schema-library",
        "version": "26336e9"
      },
      "fidelity": [
        {
          "disposition": "approximated",
          "object": "interface.enabled",
          "source": "InterfacePhysical.status",
          "reason": "a port is enabled unless its status is disabled; the library's status is not an admin state"
        },
        {
          "disposition": "approximated",
          "object": "interface.mgmt_only",
          "source": "InterfacePhysical.role",
          "reason": "the management port is the port whose role is management; the library has no management-only flag"
        },
        {
          "disposition": "omitted",
          "object": "platform.version",
          "source": "DcimPlatform",
          "reason": "the library's platform carries no version"
        }
      ]
    },
    "devices": [
      {
        "name": "n1",
        "platform": {
          "package": "nokia_srlinux"
        },
        "interfaces": [
          {
            "name": "ethernet-1/1",
            "mgmt_only": false,
            "enabled": true,
            "link": "n1:ethernet-1/1|n2:ethernet-1/1"
          },
          {
            "name": "ethernet-1/2",
            "mgmt_only": false,
            "enabled": true,
            "link": "n1:ethernet-1/2|n3:ethernet-1/2"
          },
          {
            "name": "mgmt0",
            "mgmt_only": true,
            "enabled": true
          }
        ],
        "artifact": {
          "name": "device-config",
          "content_type": "text/plain",
          "checksum": "597f6263eb7e0b539679b3956270876f",
          "content": "# n1: production configuration rendered by Infrahub (fylgja-artifacts)\n# platform Nokia SR Linux; FYLGJA-MARKER-fixture\nset / system name host-name n1\nset / network-instance default type default\nset / interface ethernet-1/1 description \"to n2 ethernet-1/1\"\nset / interface ethernet-1/1 admin-state enable\nset / interface ethernet-1/1 subinterface 0 admin-state enable\nset / network-instance default interface ethernet-1/1.0\nset / interface ethernet-1/2 description \"to n3 ethernet-1/2\"\nset / interface ethernet-1/2 admin-state enable\nset / interface ethernet-1/2 subinterface 0 admin-state enable\nset / network-instance default interface ethernet-1/2.0\n# mgmt0: out-of-band management, left to the platform\n"
        }
      },
      {
        "name": "n2",
        "platform": {
          "package": "nokia_srlinux"
        },
        "interfaces": [
          {
            "name": "ethernet-1/1",
            "mgmt_only": false,
            "enabled": true,
            "link": "n1:ethernet-1/1|n2:ethernet-1/1"
          },
          {
            "name": "ethernet-1/2",
            "mgmt_only": false,
            "enabled": true,
            "link": "n2:ethernet-1/2|n3:ethernet-1/1"
          },
          {
            "name": "mgmt0",
            "mgmt_only": true,
            "enabled": true
          }
        ],
        "artifact": {
          "name": "device-config",
          "content_type": "text/plain",
          "checksum": "5ac21560015ad6bb1e881358115d0b7a",
          "content": "# n2: production configuration rendered by Infrahub (fylgja-artifacts)\n# platform Nokia SR Linux; FYLGJA-MARKER-fixture\nset / system name host-name n2\nset / network-instance default type default\nset / interface ethernet-1/1 description \"to n1 ethernet-1/1\"\nset / interface ethernet-1/1 admin-state enable\nset / interface ethernet-1/1 subinterface 0 admin-state enable\nset / network-instance default interface ethernet-1/1.0\nset / interface ethernet-1/2 description \"to n3 ethernet-1/1\"\nset / interface ethernet-1/2 admin-state enable\nset / interface ethernet-1/2 subinterface 0 admin-state enable\nset / network-instance default interface ethernet-1/2.0\n# mgmt0: out-of-band management, left to the platform\n"
        }
      },
      {
        "name": "n3",
        "platform": {
          "package": "nokia_srlinux"
        },
        "interfaces": [
          {
            "name": "ethernet-1/1",
            "mgmt_only": false,
            "enabled": true,
            "link": "n2:ethernet-1/2|n3:ethernet-1/1"
          },
          {
            "name": "ethernet-1/2",
            "mgmt_only": false,
            "enabled": true,
            "link": "n1:ethernet-1/2|n3:ethernet-1/2"
          },
          {
            "name": "mgmt0",
            "mgmt_only": true,
            "enabled": true
          }
        ],
        "artifact": {
          "name": "device-config",
          "content_type": "text/plain",
          "checksum": "e93df96400ddbada7daa1a0777d9d3e3",
          "content": "# n3: production configuration rendered by Infrahub (fylgja-artifacts)\n# platform Nokia SR Linux; FYLGJA-MARKER-fixture\nset / system name host-name n3\nset / network-instance default type default\nset / interface ethernet-1/1 description \"to n2 ethernet-1/2\"\nset / interface ethernet-1/1 admin-state enable\nset / interface ethernet-1/1 subinterface 0 admin-state enable\nset / network-instance default interface ethernet-1/1.0\nset / interface ethernet-1/2 description \"to n1 ethernet-1/2\"\nset / interface ethernet-1/2 admin-state enable\nset / interface ethernet-1/2 subinterface 0 admin-state enable\nset / network-instance default interface ethernet-1/2.0\n# mgmt0: out-of-band management, left to the platform\n"
        }
      }
    ],
    "links": [
      {
        "id": "n1:ethernet-1/1|n2:ethernet-1/1",
        "endpoints": [
          {
            "device": "n1",
            "interface": "ethernet-1/1"
          },
          {
            "device": "n2",
            "interface": "ethernet-1/1"
          }
        ]
      },
      {
        "id": "n1:ethernet-1/2|n3:ethernet-1/2",
        "endpoints": [
          {
            "device": "n1",
            "interface": "ethernet-1/2"
          },
          {
            "device": "n3",
            "interface": "ethernet-1/2"
          }
        ]
      },
      {
        "id": "n2:ethernet-1/2|n3:ethernet-1/1",
        "endpoints": [
          {
            "device": "n2",
            "interface": "ethernet-1/2"
          },
          {
            "device": "n3",
            "interface": "ethernet-1/1"
          }
        ]
      }
    ]
  },
  "probes": []
}
